{
  "$schema": "https://hyperframes.heygen.com/schema/registry-item.json",
  "name": "tabs",
  "type": "hyperframes:component",
  "title": "Tabs",
  "description": "A minimal tab primitive with an inset mint selection edge, open content hierarchy, and a seek-safe indicator",
  "tags": ["ui-primitive", "remocn-port", "tabs", "navigation"],
  "files": [
    {
      "path": "tabs.html",
      "target": "compositions/components/tabs.html",
      "type": "hyperframes:snippet"
    }
  ],
  "preview": {
    "poster": "https://static.heygen.ai/hyperframes-oss/docs/images/catalog/components/tabs.png"
  }
}
