{
  "$schema": "https://hyperframes.heygen.com/schema/registry-item.json",
  "name": "chat-to-preview-layout",
  "type": "hyperframes:component",
  "title": "Chat to Preview Layout",
  "description": "Split-pane chat and preview layout for agent-generated UI.",
  "tags": ["showcase", "remocn-port", "ai"],
  "files": [
    {
      "path": "chat-to-preview-layout.html",
      "target": "compositions/components/chat-to-preview-layout.html",
      "type": "hyperframes:snippet"
    }
  ],
  "preview": {
    "poster": "https://static.heygen.ai/hyperframes-oss/docs/images/catalog/components/chat-to-preview-layout.png"
  }
}
