{
  "$schema": "https://hyperframes.heygen.com/schema/registry-item.json",
  "name": "settings-toggle-flow",
  "type": "hyperframes:component",
  "title": "Settings Toggle Flow",
  "description": "A composed settings flow with preference rows, toggle switches, and active-state feedback",
  "tags": ["ui-flow", "settings", "toggle"],
  "files": [
    {
      "path": "settings-toggle-flow.html",
      "target": "compositions/components/settings-toggle-flow.html",
      "type": "hyperframes:snippet"
    }
  ],
  "preview": {
    "poster": "https://static.heygen.ai/hyperframes-oss/docs/images/catalog/components/settings-toggle-flow.png"
  }
}
