{
  "$schema": "https://hyperframes.heygen.com/schema/registry-item.json",
  "name": "motion-blur",
  "type": "hyperframes:component",
  "title": "Motion Blur",
  "description": "After Effects-style motion blur — integrates each element over a shutter window (shutter angle, phase, samples per frame) by sampling the GSAP timeline at sub-frame times and averaging equal-weight additive copies of the element along its real trajectory, so translation, scale, rotation, 3D rotation and skew all drive the smear",
  "tags": ["effect", "motion-blur", "shutter", "after-effects", "velocity", "animation"],
  "files": [
    {
      "path": "motion-blur.html",
      "target": "compositions/components/motion-blur.html",
      "type": "hyperframes:snippet"
    }
  ],
  "preview": {
    "poster": "https://static.heygen.ai/hyperframes-oss/docs/images/catalog/components/motion-blur.png"
  }
}
