{
  "$schema": "https://hyperframes.heygen.com/schema/registry-item.json",
  "name": "gooey-split",
  "type": "hyperframes:block",
  "title": "Gooey Split",
  "description": "A dot splits into a three-dot menu with a gooey metaball neck, spins into a swirl mark under directional shutter motion blur, then breaks back into three dots and merges into one. The goo is an SVG blur-and-threshold filter on the dots; the blur integrates each part along its real trajectory, so the smear follows the direction and speed of the spin.",
  "dimensions": { "width": 1920, "height": 1080 },
  "duration": 4.7,
  "tags": ["effect", "gooey", "metaball", "motion-blur", "morph", "logo", "icon"],
  "files": [
    {
      "path": "gooey-split.html",
      "target": "compositions/gooey-split.html",
      "type": "hyperframes:composition"
    }
  ]
}
