{
  "$schema": "https://hyperframes.heygen.com/schema/registry-item.json",
  "name": "confetti",
  "type": "hyperframes:component",
  "title": "Confetti",
  "description": "A deterministic celebration burst with seeded particles and gravity.",
  "tags": ["effect"],
  "files": [
    {
      "path": "confetti.html",
      "target": "compositions/components/confetti.html",
      "type": "hyperframes:snippet"
    }
  ],
  "preview": {
    "poster": "https://static.heygen.ai/hyperframes-oss/docs/images/catalog/components/confetti.png"
  }
}
