{
  "$schema": "https://hyperframes.heygen.com/schema/registry-item.json",
  "name": "hologram",
  "type": "hyperframes:block",
  "title": "Hologram",
  "description": "A pale blue holographic orb with scan rings and flicker, on black. A WebGPU shader from the Shaders library (shaders.com, MIT).",
  "tags": ["webgpu", "webgpu-shader", "object", "hologram", "sci-fi", "blue"],
  "license": "Apache-2.0 AND MIT",
  "dimensions": {
    "width": 1920,
    "height": 1080
  },
  "duration": 2,
  "files": [
    {
      "path": "hologram.html",
      "target": "compositions/hologram.html",
      "type": "hyperframes:composition"
    },
    {
      "path": "lib/shaders.iife.js",
      "target": "compositions/lib/shaders.iife.js",
      "type": "hyperframes:asset"
    },
    {
      "path": "lib/shaders.THIRD-PARTY-LICENSES.txt",
      "target": "compositions/lib/shaders.THIRD-PARTY-LICENSES.txt",
      "type": "hyperframes:asset"
    }
  ],
  "preview": {
    "video": "https://static.heygen.ai/hyperframes-oss/docs/images/catalog/blocks/hologram.mp4"
  }
}
