{
  "$schema": "https://hyperframes.heygen.com/schema/registry-item.json",
  "name": "toggle",
  "type": "hyperframes:component",
  "title": "Toggle",
  "description": "A tactile toggle button with distinct pressed and unpressed states",
  "tags": ["ui-primitive", "remocn-port", "toggle", "control"],
  "files": [
    {
      "path": "toggle.html",
      "target": "compositions/components/toggle.html",
      "type": "hyperframes:snippet"
    }
  ],
  "preview": {
    "poster": "https://static.heygen.ai/hyperframes-oss/docs/images/catalog/components/toggle.png"
  }
}
