{
  "$schema": "https://hyperframes.heygen.com/schema/registry-item.json",
  "name": "tooltip",
  "type": "hyperframes:component",
  "title": "Tooltip",
  "description": "A tooltip primitive with trigger, floating label, arrow, and reveal animation",
  "tags": ["ui-primitive", "remocn-port", "tooltip", "overlay"],
  "files": [
    {
      "path": "tooltip.html",
      "target": "compositions/components/tooltip.html",
      "type": "hyperframes:snippet"
    }
  ],
  "preview": {
    "poster": "https://static.heygen.ai/hyperframes-oss/docs/images/catalog/components/tooltip.png"
  }
}
